{
  "label_id": "FILL_ME_true_005",
  "symbol": "EURUSD",
  "timeframe": "H1",
  "direction": "top",
  "hard_negative": false,
  "hard_negative_reason": null,
  "LS_bar_index": 0,
  "LS_price": 0.0,
  "LS_time": null,
  "trough1_bar_index": 0,
  "trough1_price": 0.0,
  "trough1_time": null,
  "head_bar_index": 0,
  "head_price": 0.0,
  "head_time": null,
  "trough2_bar_index": 0,
  "trough2_price": 0.0,
  "trough2_time": null,
  "RS_bar_index": 0,
  "RS_price": 0.0,
  "RS_time": null,
  "neckline_left_bar_index": 0,
  "neckline_left_price": 0.0,
  "neckline_right_bar_index": 0,
  "neckline_right_price": 0.0,
  "confirmation_bar_index": 0,
  "confirmation_price": 0.0,
  "confirm_rule": "close_beyond_neckline",
  "retest_bar_index": null,
  "H": 0.0,
  "label_quality": "gold",
  "entry_mode": "A",
  "entry_bar_index": null,
  "entry_price": null,
  "sl_price": null,
  "tp1_price": null,
  "tp2_price": null,
  "outcomes": {
    "outcome_bars": 50,
    "hit_0_5H": null,
    "hit_1_0H": null,
    "mfe": null,
    "mae": null
  },
  "false_positive": null,
  "notes": "Empty slot \u2014 fill pivots from bars; see LABELING_CHECKLIST.md",
  "bars_file": null
}
