{
  "label_id": "XAUUSD_H4_neg_EXAMPLE_false_break",
  "symbol": "XAUUSD",
  "timeframe": "H4",
  "direction": "top",
  "hard_negative": true,
  "hard_negative_reason": "false_break",
  "LS_bar_index": 50,
  "LS_price": 2350.0,
  "LS_time": null,
  "trough1_bar_index": 60,
  "trough1_price": 2320.0,
  "trough1_time": null,
  "head_bar_index": 75,
  "head_price": 2380.0,
  "head_time": null,
  "trough2_bar_index": 90,
  "trough2_price": 2325.0,
  "trough2_time": null,
  "RS_bar_index": 105,
  "RS_price": 2345.0,
  "RS_time": null,
  "neckline_left_bar_index": 60,
  "neckline_left_price": 2320.0,
  "neckline_right_bar_index": 90,
  "neckline_right_price": 2325.0,
  "confirmation_bar_index": 112,
  "confirmation_price": 2318.0,
  "confirm_rule": "close_beyond_neckline",
  "retest_bar_index": null,
  "H": 57.5,
  "label_quality": "reject",
  "entry_mode": null,
  "entry_bar_index": null,
  "entry_price": null,
  "sl_price": null,
  "tp1_price": null,
  "tp2_price": null,
  "outcomes": {
    "outcome_bars": 50,
    "hit_0_5H": null,
    "hit_1_0H": null,
    "mfe": null,
    "mae": null
  },
  "false_positive": true,
  "notes": "ILLUSTRATIVE — pierce/close fails and reverses; treat as hard negative false_break.",
  "bars_file": "XAUUSD_H4.csv"
}
