{
  "label_id": "USDJPY_H1_neg_EXAMPLE_double_top",
  "symbol": "USDJPY",
  "timeframe": "H1",
  "direction": "top",
  "hard_negative": true,
  "hard_negative_reason": "double_top",
  "LS_bar_index": 80,
  "LS_price": 150.20,
  "LS_time": null,
  "trough1_bar_index": 90,
  "trough1_price": 149.40,
  "trough1_time": null,
  "head_bar_index": 100,
  "head_price": 150.25,
  "head_time": null,
  "trough2_bar_index": 110,
  "trough2_price": 149.50,
  "trough2_time": null,
  "RS_bar_index": 120,
  "RS_price": 150.18,
  "RS_time": null,
  "neckline_left_bar_index": 90,
  "neckline_left_price": 149.40,
  "neckline_right_bar_index": 110,
  "neckline_right_price": 149.50,
  "confirmation_bar_index": 128,
  "confirmation_price": 149.30,
  "confirm_rule": "close_beyond_neckline",
  "retest_bar_index": null,
  "H": 0.80,
  "label_quality": "reject",
  "entry_mode": null,
  "entry_bar_index": null,
  "entry_price": null,
  "sl_price": null,
  "tp1_price": null,
  "tp2_price": null,
  "outcomes": {
    "outcome_bars": 50,
    "hit_0_5H": null,
    "hit_1_0H": null,
    "mfe": null,
    "mae": null
  },
  "false_positive": true,
  "notes": "ILLUSTRATIVE hard negative — two similar peaks, no clear head prominence. Detector must not accept as H&S.",
  "bars_file": "USDJPY_H1.csv"
}
