{
  "label_id": "GBPUSD_H4_inverse_EXAMPLE_fixture_down_neckline",
  "symbol": "GBPUSD",
  "timeframe": "H4",
  "direction": "inverse",
  "hard_negative": false,
  "hard_negative_reason": null,
  "LS_bar_index": 200,
  "LS_price": 1.2500,
  "LS_time": null,
  "trough1_bar_index": 210,
  "trough1_price": 1.2620,
  "trough1_time": null,
  "head_bar_index": 225,
  "head_price": 1.2400,
  "head_time": null,
  "trough2_bar_index": 240,
  "trough2_price": 1.2580,
  "trough2_time": null,
  "RS_bar_index": 255,
  "RS_price": 1.2490,
  "RS_time": null,
  "neckline_left_bar_index": 210,
  "neckline_left_price": 1.2620,
  "neckline_right_bar_index": 240,
  "neckline_right_price": 1.2580,
  "confirmation_bar_index": 265,
  "confirmation_price": 1.2635,
  "confirm_rule": "close_beyond_neckline",
  "retest_bar_index": null,
  "H": 0.0200,
  "label_quality": "gold",
  "entry_mode": "A",
  "entry_bar_index": 265,
  "entry_price": 1.2635,
  "sl_price": 1.2470,
  "tp1_price": 1.2735,
  "tp2_price": 1.2835,
  "outcomes": {
    "outcome_bars": 50,
    "hit_0_5H": null,
    "hit_1_0H": null,
    "mfe": null,
    "mae": null
  },
  "false_positive": false,
  "notes": "ILLUSTRATIVE — inverse + down-sloping neckline → close above neckline. Replace indices with real GBPUSD_H4 bars.",
  "bars_file": "GBPUSD_H4.csv"
}
