{
  "label_id": "EURUSD_H1_top_EXAMPLE_fixture_up_neckline",
  "symbol": "EURUSD",
  "timeframe": "H1",
  "direction": "top",
  "hard_negative": false,
  "hard_negative_reason": null,
  "LS_bar_index": 100,
  "LS_price": 1.1020,
  "LS_time": null,
  "trough1_bar_index": 110,
  "trough1_price": 1.0950,
  "trough1_time": null,
  "head_bar_index": 125,
  "head_price": 1.1100,
  "head_time": null,
  "trough2_bar_index": 140,
  "trough2_price": 1.0970,
  "trough2_time": null,
  "RS_bar_index": 155,
  "RS_price": 1.1010,
  "RS_time": null,
  "neckline_left_bar_index": 110,
  "neckline_left_price": 1.0950,
  "neckline_right_bar_index": 140,
  "neckline_right_price": 1.0970,
  "confirmation_bar_index": 162,
  "confirmation_price": 1.0940,
  "confirm_rule": "close_beyond_neckline",
  "retest_bar_index": null,
  "H": 0.0140,
  "label_quality": "gold",
  "entry_mode": "A",
  "entry_bar_index": 162,
  "entry_price": 1.0940,
  "sl_price": 1.1025,
  "tp1_price": 1.0870,
  "tp2_price": 1.0800,
  "outcomes": {
    "outcome_bars": 50,
    "hit_0_5H": null,
    "hit_1_0H": null,
    "mfe": null,
    "mae": null
  },
  "false_positive": false,
  "notes": "ILLUSTRATIVE fixture only — replace with real bar indices from your EURUSD_H1.csv. Confirmation branch: top + up-sloping neckline → close_beyond_neckline.",
  "bars_file": "EURUSD_H1.csv"
}
